{
  "entity": "Hero",
  "plural": "heroes",
  "labels": {
    "singular": "Hero",
    "plural": "Heroes"
  },
  "kinds": [
    "entity",
    "form",
    "manage"
  ],
  "fields": [
    {
      "name": "name",
      "label": "Codename",
      "required": true,
      "type": "string",
      "help": "Public-facing hero name."
    },
    {
      "name": "alias",
      "label": "Alter ego",
      "required": true,
      "type": "string",
      "help": "Civilian identity, kept off the public roster."
    },
    {
      "name": "heroClass",
      "label": "Power class",
      "required": true,
      "type": "enum",
      "options": [
        "Aerial",
        "Energy",
        "Psionic",
        "Tech",
        "Mutant",
        "Cosmic",
        "Enhanced"
      ]
    },
    {
      "name": "power",
      "label": "Power index",
      "required": true,
      "type": "number",
      "min": 0,
      "max": 100,
      "help": "Power index, 0 to 100."
    },
    {
      "name": "notes",
      "label": "Field notes",
      "required": false,
      "type": "text",
      "help": "Operational summary for the dossier."
    },
    {
      "name": "active",
      "label": "Active duty",
      "required": true,
      "type": "boolean",
      "default": true,
      "help": "Available for mission assignment right now."
    },
    {
      "name": "status",
      "label": "Status",
      "required": true,
      "type": "enum",
      "inForm": false,
      "options": [
        "Active",
        "Injured",
        "Reserve",
        "MIA"
      ],
      "default": "Active"
    },
    {
      "name": "clearance",
      "label": "Clearance tier",
      "required": true,
      "type": "enum",
      "inForm": false,
      "options": [
        "Tier 1",
        "Tier 2",
        "Tier 3",
        "Tier 4",
        "Tier 5"
      ],
      "default": "Tier 1"
    },
    {
      "name": "missions",
      "label": "Missions",
      "required": true,
      "type": "number",
      "inForm": false,
      "min": 0,
      "default": 0
    },
    {
      "name": "successRate",
      "label": "Success rate (%)",
      "required": true,
      "type": "number",
      "inForm": false,
      "min": 0,
      "max": 100,
      "default": 0
    }
  ],
  "examples": [
    {
      "name": "Silverwing",
      "alias": "Ada Voss",
      "heroClass": "Aerial",
      "power": 88,
      "notes": "Precision flyer. Excels at extraction and high-altitude recon. Pairs well with ground-anchor heroes on breach ops.",
      "active": true,
      "status": "Active",
      "clearance": "Tier 4",
      "missions": 64,
      "successRate": 92
    },
    {
      "name": "Dr. Ion",
      "alias": "Marcus Reyes",
      "heroClass": "Energy",
      "power": 94,
      "notes": "Directed-energy specialist. High output, needs a cooldown window between deployments.",
      "active": true,
      "status": "Active",
      "clearance": "Tier 5",
      "missions": 118,
      "successRate": 88
    },
    {
      "name": "Vantablack",
      "alias": "Unknown",
      "heroClass": "Psionic",
      "power": 81,
      "notes": "Stealth and misdirection. Prefers solo infiltration; low profile by design.",
      "active": false,
      "status": "Reserve",
      "clearance": "Tier 3",
      "missions": 29,
      "successRate": 79
    },
    {
      "name": "Aurora Vale",
      "alias": "Lena Park",
      "heroClass": "Cosmic",
      "power": 97,
      "notes": "Cosmic-tier heavy hitter. Reserved for tier-4 and tier-5 threat responses only.",
      "active": true,
      "status": "Active",
      "clearance": "Tier 5",
      "missions": 151,
      "successRate": 90
    },
    {
      "name": "Magnetar",
      "alias": "Idris Kane",
      "heroClass": "Enhanced",
      "power": 76,
      "notes": "Magnetic-field control. Currently on medical hold after Harbor Breach.",
      "active": false,
      "status": "Injured",
      "clearance": "Tier 3",
      "missions": 57,
      "successRate": 84
    },
    {
      "name": "The Tinkerer",
      "alias": "Sam Okafor",
      "heroClass": "Tech",
      "power": 69,
      "notes": "Gadget and drone support. Force multiplier on any team; rarely deployed alone.",
      "active": true,
      "status": "Active",
      "clearance": "Tier 2",
      "missions": 22,
      "successRate": 95
    },
    {
      "name": "Halcyon",
      "alias": "Priya Nair",
      "heroClass": "Psionic",
      "power": 85,
      "notes": "Crowd-calming empath. De-escalation specialist for civilian-dense operations.",
      "active": true,
      "status": "Active",
      "clearance": "Tier 4",
      "missions": 73,
      "successRate": 87
    },
    {
      "name": "Rift",
      "alias": "Classified",
      "heroClass": "Cosmic",
      "power": 91,
      "notes": "Short-range teleport. Powerful but unstable; flagged for supervised deployment.",
      "active": false,
      "status": "Reserve",
      "clearance": "Tier 4",
      "missions": 44,
      "successRate": 82
    },
    {
      "name": "Ember Cho",
      "alias": "Jae Cho",
      "heroClass": "Energy",
      "power": 78,
      "notes": "Thermal projection. Strong area control, watch collateral on urban ops.",
      "active": true,
      "status": "Active",
      "clearance": "Tier 3",
      "missions": 48,
      "successRate": 86
    },
    {
      "name": "Null",
      "alias": "Unknown",
      "heroClass": "Mutant",
      "power": 83,
      "notes": "Power-nullification field. Last seen during Operation Nightfall; status unresolved.",
      "active": false,
      "status": "MIA",
      "clearance": "Tier 4",
      "missions": 66,
      "successRate": 80
    },
    {
      "name": "Grond",
      "alias": "Boris Volkov",
      "heroClass": "Enhanced",
      "power": 72,
      "notes": "Raw strength and durability. The wall the rest of the team stands behind.",
      "active": true,
      "status": "Active",
      "clearance": "Tier 2",
      "missions": 31,
      "successRate": 90
    },
    {
      "name": "Ms. Meridian",
      "alias": "Grace Bello",
      "heroClass": "Tech",
      "power": 80,
      "notes": "Tactical AI handler. Coordinates multi-hero ops from the field.",
      "active": true,
      "status": "Active",
      "clearance": "Tier 3",
      "missions": 59,
      "successRate": 89
    }
  ],
  "manage": {
    "icon": "lucideUsers",
    "createLabel": "Recruit",
    "createRoute": "/recruit",
    "columns": [
      {
        "field": "name"
      },
      {
        "field": "heroClass",
        "badge": {
          "variants": {},
          "fallback": "secondary"
        }
      },
      {
        "field": "power"
      },
      {
        "field": "status",
        "badge": {
          "variants": {
            "Active": "default",
            "Injured": "secondary",
            "Reserve": "outline",
            "MIA": "destructive"
          },
          "fallback": "outline"
        }
      },
      {
        "field": "clearance"
      },
      {
        "field": "missions"
      }
    ],
    "search": [
      "name",
      "alias"
    ],
    "filters": [
      {
        "field": "heroClass",
        "control": "select"
      }
    ],
    "sort": {
      "field": "power",
      "direction": "desc"
    },
    "summary": true
  }
}
